"Виктория Семеновна Панфилова","г. Москва  алл. Родниковая  д. 9/4","antipromanov@yahoo.com"
"Никитина Маргарита Робертовна","г. Москва  алл. Карьерная  д. 3","antonin_31@hotmail.com"
"Дмитрий Дмитриевич Рогов","г. Москва  ул. Верхняя  д. 710 стр. 145","osipkapustin@yahoo.com"
"Богданов Галактион Харламович","г. Москва  ул. Серафимовича  д. 6 к. 921","ovlasova@yahoo.com"
"Парамон Ануфриевич Архипов","г. Москва  наб. Иркутская  д. 51 стр. 2","demjan_2002@mail.ru"
"Назаров Севастьян Иларионович","г. Москва  пер. Геологический  д. 919","sidorovoleg@ip.ru"
"Борисова Пелагея Степановна","г. Москва  бул. Каштановый  д. 5 к. 68","dobromisl_91@oao.org"
"Евгения Львовна Морозова","г. Москва  ш. Безымянное  д. 243","kuzminsilanti@ip.info"
"Михеева Виктория Афанасьевна","г. Москва  наб. 9 Января  д. 4 стр. 24","visheslav93@hotmail.com"
"Афиноген Вилорович Воронов","г. Москва  наб. Революции  д. 28 стр. 5","ratibor1971@rao.info"
